{
  "version": "0.5.0",
  "description": "Developer retrieval evaluation set for the Genshin lore search engine. Cases are intentionally small and lore-heavy so they can be run after every ranking or alias change.",
  "default_limit": 10,
  "cases": [
    {
      "id": "heavenly_principles_core",
      "query": "천리",
      "expected_route": "analysis",
      "expected_concepts": ["manual:heavenly_principles"],
      "expected_canonical_ids": ["project_amber:quest:1406", "project_amber:quest:1606"],
      "expected_content_types": ["quest"],
      "notes": "천리/Heavenly Principles 직접 언급 퀘스트 회수."
    },
    {
      "id": "khaenriah_core",
      "query": "Khaenri'ah",
      "expected_route": "analysis",
      "expected_concepts": ["manual:khaenriah"],
      "expected_canonical_ids": ["project_amber:quest:1308", "project_amber:quest:1104"],
      "expected_content_types": ["quest"],
      "notes": "영어 질의가 한국어/중국어/일본어 병렬 표현으로 확장되는지 확인."
    },
    {
      "id": "phanes_four_shades",
      "query": "파네스 네 그림자",
      "expected_route": "analysis",
      "expected_concepts": ["manual:phanes", "manual:four_shades"],
      "expected_canonical_ids": ["project_amber:book:1036"],
      "expected_content_types": ["book"],
      "notes": "일월 과거사 / Before Sun and Moon 회수."
    },
    {
      "id": "irminsul_memory_connection",
      "query": "세계수와 기억 조작 연결 가능성",
      "expected_route": "research",
      "expected_concepts": ["manual:irminsul"],
      "expected_canonical_ids": ["project_amber:quest:1307", "project_amber:quest:1301"],
      "expected_content_types": ["quest"],
      "notes": "세계수-기억 계열 연결 질의."
    },
    {
      "id": "artifact_exact_lookup",
      "query": "절연의 기치 효과",
      "expected_route": "basic_lookup",
      "expected_concepts": ["project_amber:reliquary:15020"],
      "expected_canonical_ids": ["project_amber:reliquary:15020"],
      "expected_content_types": ["reliquary"],
      "notes": "단순 게임 정보 조회가 연구 모드로 과확장되지 않는지 확인."
    },
    {
      "id": "loom_of_fate_core",
      "query": "운명의 베틀",
      "expected_route": "analysis",
      "expected_concepts": ["manual:loom_of_fate"],
      "expected_canonical_ids": ["project_amber:quest:1406", "project_amber:quest:1104"],
      "expected_content_types": ["quest"],
      "notes": "운명의 베틀 핵심 퀘스트 회수."
    },
    {
      "id": "abyss_order_core",
      "query": "심연 교단",
      "expected_route": "analysis",
      "expected_concepts": ["manual:abyss"],
      "expected_canonical_ids": ["project_amber:quest:1506", "project_amber:quest:1308"],
      "expected_content_types": ["quest"],
      "notes": "심연 교단 관련 퀘스트와 수동 심연 seed 회수."
    },
    {
      "id": "celestia_core",
      "query": "셀레스티아",
      "expected_route": "analysis",
      "expected_concepts": ["manual:celestia"],
      "expected_canonical_ids": ["project_amber:quest:1104", "project_amber:quest:1611"],
      "expected_content_types": ["quest"],
      "notes": "셀레스티아 직접 언급과 다국어 퀘스트 회수."
    },
    {
      "id": "descender_core",
      "query": "강림자",
      "expected_route": "analysis",
      "expected_concepts": ["manual:descender"],
      "expected_canonical_ids": ["project_amber:quest:1305", "project_amber:quest:1405"],
      "expected_content_types": ["quest"],
      "notes": "강림자 개념이 수메르/폰타인 핵심 퀘스트로 연결되는지 확인."
    },
    {
      "id": "forbidden_knowledge_core",
      "query": "금지된 지식",
      "expected_route": "analysis",
      "expected_concepts": ["manual:forbidden_knowledge"],
      "expected_canonical_ids": ["project_amber:quest:1308", "project_amber:quest:2039"],
      "expected_content_types": ["quest"],
      "notes": "금지된 지식 seed와 관련 공식 텍스트 회수."
    },
    {
      "id": "nibelung_core",
      "query": "니벨룽겐",
      "expected_route": "analysis",
      "expected_concepts": ["manual:nibelung"],
      "expected_canonical_ids": ["project_amber:quest:1606", "project_amber:quest:1608", "project_amber:quest:2039"],
      "expected_content_types": ["quest"],
      "notes": "니벨룽겐과 용왕 관련 최신 퀘스트 회수."
    },
    {
      "id": "phanes_primordial_one",
      "query": "원초의 그분",
      "expected_route": "analysis",
      "expected_concepts": ["manual:phanes"],
      "expected_canonical_ids": ["project_amber:book:1036"],
      "expected_content_types": ["book"],
      "notes": "파네스 별칭이 일월 과거사로 연결되는지 확인."
    },
    {
      "id": "istaroth_core",
      "query": "이스타로트",
      "expected_route": "analysis",
      "expected_concepts": ["manual:istaroth"],
      "expected_canonical_ids": ["project_amber:quest:1506", "project_amber:book:1036"],
      "expected_content_types": ["quest", "book"],
      "notes": "이스타로트 신규 manual seed 회수."
    },
    {
      "id": "false_sky_core",
      "query": "가짜 하늘",
      "expected_route": "analysis",
      "expected_concepts": ["manual:false_sky"],
      "expected_canonical_ids": ["project_amber:quest:1600", "project_amber:quest:1608"],
      "expected_content_types": ["quest"],
      "notes": "가짜 하늘 motif seed와 나틀/공월 계열 퀘스트 회수."
    },
    {
      "id": "moon_sisters_core",
      "query": "달의 세 여신",
      "expected_route": "analysis",
      "expected_concepts": ["manual:moon_sisters"],
      "expected_canonical_ids": ["project_amber:quest:1606", "project_amber:quest:1608"],
      "expected_content_types": ["quest"],
      "notes": "달의 세 여신 신규 seed와 공월 퀘스트 회수."
    },
    {
      "id": "divine_throne_core",
      "query": "신좌",
      "expected_route": "analysis",
      "expected_concepts": ["manual:divine_throne"],
      "expected_canonical_ids": ["project_amber:quest:1405", "project_amber:quest:1501"],
      "expected_content_types": ["quest"],
      "notes": "신좌/왕좌 계열 motif seed 회수."
    },
    {
      "id": "primordial_dragon_king_core",
      "query": "원초의 용왕",
      "expected_route": "analysis",
      "expected_concepts": ["manual:primordial_dragon_king"],
      "expected_canonical_ids": ["project_amber:quest:2039", "project_amber:quest:1608"],
      "expected_content_types": ["quest"],
      "notes": "원초의 용왕 신규 seed와 니벨룽겐 관련 퀘스트 회수."
    },
    {
      "id": "sinner_khaenriah_core",
      "query": "죄인 켄리아",
      "expected_route": "analysis",
      "expected_concepts": ["manual:khaenriah", "manual:sinner"],
      "expected_canonical_ids": ["project_amber:quest:1406", "project_amber:quest:76090"],
      "expected_content_types": ["quest"],
      "notes": "죄인 신규 seed와 켄리아 seed가 함께 잡히는지 확인."
    }
  ],
  "thresholds": {
    "canonical_recall_at_k": 0.6,
    "concept_recall": 0.6,
    "route_accuracy": 0.8,
    "mrr": 0.35
  }
}
